,Title,Author,Published,Link
222,"A Structural Model of ""Alpha"" for the Capital Adequacy Ratios of Islamic Banks","Baldwin, K.",May 2019,https://pureportal.coventry.ac.uk/en/publications/a-structural-model-of-alpha-for-the-capital-adequacy-ratios-of-is
223,Risk Management in Islamic Banks,"Baldwin, K.",2016,https://pureportal.coventry.ac.uk/en/publications/risk-management-in-islamic-banks-2
224,The Management of Refinancing Risk in Islamic Banks,"Baldwin, K.",17 Aug 2015,https://pureportal.coventry.ac.uk/en/publications/the-management-of-refinancing-risk-in-islamic-banks-2
225,"From Theory to Practice: a new approach to real estate risk, part II","Baldwin, K.",2005,https://pureportal.coventry.ac.uk/en/publications/from-theory-to-practice-a-new-approach-to-real-estate-risk-part-i-2
226,Using Twitter for Collaborative Student and Project Manager Learning: Reflections from a UK Pilot Project,"Barnett-Richards, K.",2016,https://pureportal.coventry.ac.uk/en/publications/using-twitter-for-collaborative-student-and-project-manager-learn-2
227,The Interprofessional Classroom; Integrating Project Management With Supply Chain Management,"Barnett-Richards, K.",16 Apr 2015,https://pureportal.coventry.ac.uk/en/publications/the-interprofessional-classroom-integrating-project-management-wi
228,Using Twitter as a Project Management Learning Intervention #PSCMChat,"Barnett-Richards, K.",16 Apr 2015,https://pureportal.coventry.ac.uk/en/publications/using-twitter-as-a-project-management-learning-intervention-pscmc
229,Pearson Education (Publisher),Kate Barnett-Richards,1 Sep 2013,https://pureportal.coventry.ac.uk/en/activities/pearson-education-publisher
230,ABS HEA Conference Innovation in Challenging Times,Kate Barnett-Richards,1 Apr 2012,https://pureportal.coventry.ac.uk/en/activities/abs-hea-conference-innovation-in-challenging-times
231,RAISE Conference Engaging Students in Challenging Times,Kate Barnett-Richards,9 Sep 2011,https://pureportal.coventry.ac.uk/en/activities/raise-conference-engaging-students-in-challenging-times-2
232,European Conference on E-Learning,Kate Barnett-Richards,11 Nov 2011,https://pureportal.coventry.ac.uk/en/activities/european-conference-on-e-learning-2
233,European Conference on E-Learning,Kate Barnett-Richards,11 Nov 2011,https://pureportal.coventry.ac.uk/en/activities/european-conference-on-e-learning
234,Financial contagion effects of major crises in African stock markets,"Bello, J.",Jul 2022,https://pureportal.coventry.ac.uk/en/publications/financial-contagion-effects-of-major-crises-in-african-stock-mark
235,Finding our place in the world with the Sustainable Development Goals,"Bello, J.",18 Feb 2021,https://pureportal.coventry.ac.uk/en/publications/finding-our-place-in-the-world-with-the-sustainable-development-g
236,Providing an enabling environment to promote the Sustainable Development Goals: Coventry University’s experience,"Bello, J.",7 Sep 2020,https://pureportal.coventry.ac.uk/en/publications/providing-an-enabling-environment-to-promote-the-sustainable-deve
237,The Impact of the 2007-09 and Euro-Zone Crises on Natural Resources Sector Beta in African Emerging Markets: The Impact of the 2007-09 and Euro-Zone Crises on Natural Resources Sector Beta in African Emerging Markets,"Tony-Okeke, U.",1 Oct 2018,https://pureportal.coventry.ac.uk/en/publications/the-impact-of-the-2007-09-and-euro-zone-crises-on-natural-resourc
238,Financial Contagion from US to African Frontier Markets during the 2007-2009 Global Financial Crisis,"Ahmadu-Bello, J.",2016,https://pureportal.coventry.ac.uk/en/publications/financial-contagion-from-us-to-african-frontier-markets-during-th
239,Drifts in Governance: Evidence from the management of COVID-19 in China,"Chen, J.",2021,https://pureportal.coventry.ac.uk/en/publications/drifts-in-governance-evidence-from-the-management-of-covid-19-in-
240,The hegemony in transfer pricing practices: The case of a Chinese organisation,"Chen, J.",2019,https://pureportal.coventry.ac.uk/en/publications/the-hegemony-in-transfer-pricing-practices-the-case-of-a-chinese-
241,Measuring the impact of corporate governance on non-financial reporting in the top HEIs worldwide,"Chhatbar, M.",12 May 2022,https://pureportal.coventry.ac.uk/en/publications/measuring-the-impact-of-corporate-governance-on-non-financial-rep
242,Do non-communicable diseases influence sustainable development in Sub-Saharan Africa? A panel autoregressive distributive lag model approach,"Kabajulizi, J.",Mar 2022,https://pureportal.coventry.ac.uk/en/publications/do-non-communicable-diseases-influence-sustainable-development-in
243,Is there a Mission Drift in Microfinance? Some New Empirical Evidence from Uganda,"Darko, F.",Mar 2016,https://pureportal.coventry.ac.uk/en/publications/is-there-a-mission-drift-in-microfinance-some-new-empirical-evide
244,Microfinance and Poverty Reduction: The Case Study of Selected Institutions in the Greater Accra Region of Ghana,"Darko, F.",2015,https://pureportal.coventry.ac.uk/en/publications/microfinance-and-poverty-reduction-the-case-study-of-selected-ins
245,Determinants of Capital Flight: New Panel Evidence from Sub-Saharan Africa (SSA),"Egbulonu, A.",30 Dec 2020,https://pureportal.coventry.ac.uk/en/publications/determinants-of-capital-flight-new-panel-evidence-from-sub-sahara
246,"The long run relationship between fish production, marine trade balance and foreign direct investment: An empirical study of Omani economy","Egbulonu, A.",4 Nov 2020,https://pureportal.coventry.ac.uk/en/publications/the-long-run-relationship-between-fish-production-marine-trade-ba
247,Corporate Social Responsibility and Financial Performance of Product and Service-Based Firms Listed on London Stock Exchange,"Elmghaamez, I.",1 Apr 2022,https://pureportal.coventry.ac.uk/en/publications/corporate-social-responsibility-and-financial-performance-of-prod
248,"Diffusion theory, transnational antecedents and International Standards on Auditing adoption around the world","Elmghaamez, I.",Apr 2022,https://pureportal.coventry.ac.uk/en/publications/diffusion-theory-transnational-antecedents-and-international-stan
249,The diffusion of innovation theory and the effects of IFRS adoption by multinational corporations on capital market performance: a cross-country analysis,"Elmghaamez, I.",1 Jan 2022,https://pureportal.coventry.ac.uk/en/publications/the-diffusion-of-innovation-theory-and-the-effects-of-ifrs-adopti
250,"Corporate Governance and Financial Performance of Firms Listed on Asian Pacific Stocks: Evidence from Malaysia, Thailand, and Singapore","Elmghaamez, I.",18 Sep 2021,https://pureportal.coventry.ac.uk/en/publications/corporate-governance-and-financial-performance-of-firms-listed-on
251,Internal corporate governance mechanisms and financial performance: evidence from the UKs top FTSE 100 listed companies,"Elmghaamez, I.",2 Apr 2021,https://pureportal.coventry.ac.uk/en/publications/internal-corporate-governance-mechanisms-and-financial-performanc
252,Reasons behind the worldwide diversity in identity and issuance of good governance codes,"Elmghaamez, I.",Jun 2021,https://pureportal.coventry.ac.uk/en/publications/reasons-behind-the-worldwide-diversity-in-identity-and-issuance-o
253,Did Corporate Governance Compliance Have an Impact on Auditor Selection and Quality? Evidence From FTSE 350,"Elmghaamez, I.",1 Sep 2020,https://pureportal.coventry.ac.uk/en/publications/did-corporate-governance-compliance-have-an-impact-on-auditor-sel
254,Financial Market Consequences of Early Adoption of International Standards on Auditing: International Evidence,"Elmghaamez, I.",21 Jul 2020,https://pureportal.coventry.ac.uk/en/publications/financial-market-consequences-of-early-adoption-of-international-
255,Antecedents and Consequences of the Worldwide Diffusion of Accounting Innovations: The Case of International Accounting and Auditing Standards,"Elmghaamez, I.",11 Mar 2019,https://pureportal.coventry.ac.uk/en/publications/antecedents-and-consequences-of-the-worldwide-diffusion-of-accoun
256,Assessing the Effectiveness of Internal Governance Controls: The Case of Internal Auditors Skills and Challenges in Libya,"Elmghaamez, I.",7 Mar 2016,https://pureportal.coventry.ac.uk/en/publications/assessing-the-effectiveness-of-internal-governance-controls-the-c
257,Clinicians’ informal acquisition of accounting literacy in UK clinical commissioning groups,"Enombu, J. A.",22 Jun 2022,https://pureportal.coventry.ac.uk/en/publications/clinicians-informal-acquisition-of-accounting-literacy-in-uk-clin
